[
  {
    "id": "soccer",
    "label": "Soccer",
    "status": "active",
    "aliases": [
      "football"
    ]
  },
  {
    "id": "basketball",
    "label": "Basketball",
    "status": "not-mapped",
    "aliases": [
      "nba",
      "bal"
    ]
  },
  {
    "id": "american-football",
    "label": "American football",
    "status": "not-mapped",
    "aliases": [
      "nfl"
    ]
  },
  {
    "id": "motorsport",
    "label": "Motorsport",
    "status": "not-mapped",
    "aliases": [
      "f1",
      "formula",
      "racing"
    ]
  },
  {
    "id": "events",
    "label": "Tournaments & governing bodies",
    "status": "not-mapped",
    "aliases": [
      "fifa",
      "uefa",
      "world cup",
      "cycling"
    ]
  },
  {
    "id": "baseball",
    "label": "Baseball",
    "status": "not-mapped",
    "aliases": [
      "mlb"
    ]
  },
  {
    "id": "cycling",
    "label": "Cycling",
    "status": "not-mapped",
    "aliases": [
      "road cycling",
      "pro cycling",
      "uci",
      "worldtour"
    ]
  }
]
